{
 "agent_guide": "agents.html",
 "digests": [
  {
   "canonical_markdown": "digests/2026-10-19.md",
   "date": "2026-10-19",
   "html": "https://fapd.info/2026-10-19.html",
   "teaser": "On the legislative side, the digest carries no recorded floor votes from either chamber."
  },
  {
   "canonical_markdown": "digests/2026-10-18.md",
   "date": "2026-10-18",
   "html": "https://fapd.info/2026-10-18.html",
   "teaser": "This is a short review: few agency publications were observed for this digest day, and none met the digest's summary rules, so there are no item summaries to draw on."
  },
  {
   "canonical_markdown": "digests/2026-10-17.md",
   "date": "2026-10-17",
   "html": "https://fapd.info/2026-10-17.html",
   "teaser": "The digest carries six agency press releases."
  },
  {
   "canonical_markdown": "digests/2026-10-16.md",
   "date": "2026-10-16",
   "html": "https://fapd.info/2026-10-16.html",
   "teaser": "The digest carries 45 House and 4 Senate floor entries from the Congressional Record, plus 38 Extensions of Remarks and 6 Daily Digest entries."
  },
  {
   "canonical_markdown": "digests/2026-10-15.md",
   "date": "2026-10-15",
   "html": "https://fapd.info/2026-10-15.html",
   "teaser": "The digest carries 13 bills introduced in the House and two in the Senate; no recorded floor votes appear among the items."
  },
  {
   "canonical_markdown": "digests/2026-10-14.md",
   "date": "2026-10-14",
   "html": "https://fapd.info/2026-10-14.html",
   "teaser": "On the congressional side, the digest carries 28 House and 4 Senate Congressional Record items, along with 6 Daily Digest entries and 41 Extensions of Remarks."
  },
  {
   "canonical_markdown": "digests/2026-10-13.md",
   "date": "2026-10-13",
   "html": "https://fapd.info/2026-10-13.html",
   "teaser": "The digest includes two presidential proclamations, designating October 2026 as National Energy Dominance Month, which describes various energy policy actions, and October 12, 2026, as Columbus Day."
  },
  {
   "canonical_markdown": "digests/2026-10-12.md",
   "date": "2026-10-12",
   "html": "https://fapd.info/2026-10-12.html",
   "teaser": "This is a short review: few publications were observed for this digest day, and none met the digest's summary rules, so there are no item summaries to draw on."
  },
  {
   "canonical_markdown": "digests/2026-10-11.md",
   "date": "2026-10-11",
   "html": "https://fapd.info/2026-10-11.html",
   "teaser": "The digest carries 14 agency press releases from the executive branch."
  },
  {
   "canonical_markdown": "digests/2026-10-10.md",
   "date": "2026-10-10",
   "html": "https://fapd.info/2026-10-10.html",
   "teaser": "The digest carries 41 House and 4 Senate Congressional Record entries, 80 Extensions of Remarks, and 5 Daily Digest items; none of the item summaries describe recorded votes."
  },
  {
   "canonical_markdown": "digests/2026-10-09.md",
   "date": "2026-10-09",
   "html": "https://fapd.info/2026-10-09.html",
   "teaser": "The digest carries one presidential document and one presidential memorandum."
  },
  {
   "canonical_markdown": "digests/2026-10-08.md",
   "date": "2026-10-08",
   "html": "https://fapd.info/2026-10-08.html",
   "teaser": "The digest carries no floor proceedings or recorded votes from either chamber."
  },
  {
   "canonical_markdown": "digests/2026-10-07.md",
   "date": "2026-10-07",
   "html": "https://fapd.info/2026-10-07.html",
   "teaser": "The digest carries Congressional Record material from both chambers: 29 House items, 4 Senate items, 5 Daily Digest entries and 42 Extensions of Remarks, with no recorded votes among the summarized items."
  },
  {
   "canonical_markdown": "digests/2026-10-06.md",
   "date": "2026-10-06",
   "html": "https://fapd.info/2026-10-06.html",
   "teaser": "The digest carries 85 House and 20 Senate entries from the Congressional Record, along with 74 Extensions of Remarks and 11 Daily Digest entries."
  },
  {
   "canonical_markdown": "digests/2026-10-05.md",
   "date": "2026-10-05",
   "html": "https://fapd.info/2026-10-05.html",
   "teaser": "The digest carries two presidential action entries, both for an executive order titled \"Emergency Tax Relief on Diesel Fuel.\""
  },
  {
   "canonical_markdown": "digests/2026-10-04.md",
   "date": "2026-10-04",
   "html": "https://fapd.info/2026-10-04.html",
   "teaser": "This is a short review: few publications were observed for this digest day, and none met the digest's summary rules, so there are no item summaries to draw on."
  },
  {
   "canonical_markdown": "digests/2026-10-03.md",
   "date": "2026-10-03",
   "html": "https://fapd.info/2026-10-03.html",
   "teaser": "On the congressional side, the digest carries 14 bills introduced in the Senate."
  },
  {
   "canonical_markdown": "digests/2026-10-02.md",
   "date": "2026-10-02",
   "html": "https://fapd.info/2026-10-02.html",
   "teaser": "The digest carries 98 House and 4 Senate entries from the Congressional Record, plus 55 Extensions of Remarks and 6 Daily Digest entries."
  },
  {
   "canonical_markdown": "digests/2026-10-01.md",
   "date": "2026-10-01",
   "html": "https://fapd.info/2026-10-01.html",
   "teaser": "The digest carries 133 Senate items from the Congressional Record, one roll-call vote record, and 12 Senate-engrossed bill versions."
  },
  {
   "canonical_markdown": "digests/2026-09-30.md",
   "date": "2026-09-30",
   "html": "https://fapd.info/2026-09-30.html",
   "teaser": "The Senate floor record carries 82 Senate items and three recorded votes."
  },
  {
   "canonical_markdown": "digests/2026-09-29.md",
   "date": "2026-09-29",
   "html": "https://fapd.info/2026-09-29.html",
   "teaser": "The digest carries 58 Senate and 38 House Congressional Record items, 16 Extensions of Remarks, eight Daily Digest entries, and two recorded roll-call votes."
  },
  {
   "canonical_markdown": "digests/2026-09-28.md",
   "date": "2026-09-28",
   "html": "https://fapd.info/2026-09-28.html",
   "teaser": "The digest carries six recorded roll-call votes and 48 bills introduced in the House."
  },
  {
   "canonical_markdown": "digests/2026-09-27.md",
   "date": "2026-09-27",
   "html": "https://fapd.info/2026-09-27.html",
   "teaser": null
  },
  {
   "canonical_markdown": "digests/2026-09-26.md",
   "date": "2026-09-26",
   "html": "https://fapd.info/2026-09-26.html",
   "teaser": "The digest carries 64 bill versions: 36 introduced in the Senate, 16 introduced in the House, nine agreed to in the Senate, two placed on the Senate calendar and one reported in the Senate."
  },
  {
   "canonical_markdown": "digests/2026-09-25.md",
   "date": "2026-09-25",
   "html": "https://fapd.info/2026-09-25.html",
   "teaser": "The Senate resumed consideration of S. 4668, the \"PROTECT COLLEGE SPORTS ACT OF 2026,\" and H. Con. Res. 89 regarding U.S. Armed Forces."
  },
  {
   "canonical_markdown": "digests/2026-09-24.md",
   "date": "2026-09-24",
   "html": "https://fapd.info/2026-09-24.html",
   "teaser": "The digest carries 46 bills introduced in the House and 19 in the Senate, with one bill placed on the Senate calendar."
  },
  {
   "canonical_markdown": "digests/2026-09-23.md",
   "date": "2026-09-23",
   "html": "https://fapd.info/2026-09-23.html",
   "teaser": "The digest carries 690 House and 527 Senate Congressional Record items, 199 Extensions of Remarks, 61 Daily Digest entries and one recorded-vote document."
  },
  {
   "canonical_markdown": "digests/2026-09-22.md",
   "date": "2026-09-22",
   "html": "https://fapd.info/2026-09-22.html",
   "teaser": "The digest carries 127 House and four Senate Congressional Record items, 52 Extensions of Remarks, 12 Daily Digest entries, and two recorded votes."
  },
  {
   "canonical_markdown": "digests/2026-09-21.md",
   "date": "2026-09-21",
   "html": "https://fapd.info/2026-09-21.html",
   "teaser": "No congressional floor proceedings or recorded votes appear in this digest."
  },
  {
   "canonical_markdown": "digests/2026-09-20.md",
   "date": "2026-09-20",
   "html": "https://fapd.info/2026-09-20.html",
   "teaser": "The digest carries four agency press releases as the executive and regulatory record observed for the day; no rules, proposed rules, or presidential documents appear."
  },
  {
   "canonical_markdown": "digests/2026-09-19.md",
   "date": "2026-09-19",
   "html": "https://fapd.info/2026-09-19.html",
   "teaser": "The digest carries eleven Congressional Record documents observed on this publication day: six Daily Digest items and five covering Senate proceedings."
  },
  {
   "canonical_markdown": "digests/2026-09-18.md",
   "date": "2026-09-18",
   "html": "https://fapd.info/2026-09-18.html",
   "teaser": "The Senate confirmed Kasdin Miller Mitchell of Texas as United States District Judge for the Northern District of Texas by a vote of 49-45, following a 49-47 cloture vote on the nomination, and resumed consideration of S. 4668, the Protect College Sports Act of 2026, with submitted amendments addressing student athlete name, image, and likeness rights, liability exceptions, HBCU sports infrastructure, and a proposed Bring Our Heroes Home Act records collection; senators also delivered Constitution Day remarks."
  },
  {
   "canonical_markdown": "digests/2026-09-17.md",
   "date": "2026-09-17",
   "html": "https://fapd.info/2026-09-17.html",
   "teaser": "The House passed 29 measures to engrossment and reported one, while the Senate reported 54 bills and introduced one; nine House-passed measures were referred in the Senate, and twelve bills were introduced in the House."
  },
  {
   "canonical_markdown": "digests/2026-09-16.md",
   "date": "2026-09-16",
   "html": "https://fapd.info/2026-09-16.html",